{"schema_version":1,"package_id":"sha256:cf40a19fe65cad8582fabcc1df5f04e6cf7967433d3036ff554a8cf8c37abe54","project_id":"mozak","release_id":"pf-0015-fixture-r1","predecessor":null,"restores":null,"artifacts":[{"kind":"human_overview","path":"overview.md","media_type":"text/markdown; charset=utf-8","sha256":"9ac69bcbe03197440ac87dbe300ef5997bf6326ac4da712d6031943d733954b3","bytes":60},{"kind":"project_release","path":"release.json","media_type":"application/vnd.mozak.project-release+json","sha256":"5488fb111fd5f6dbd4736701b0e0e6ec78da9cf64a75bae43ee57ff841bb66a4","bytes":2626}]}
